{
  "schema_version": "1.0",
  "verdict_id": "verdict_candidate_approve_0001",
  "request_id": "req_xau_20260716_0001",
  "setup_id": "setup_xau_20260716_0001",
  "correlation_id": "corr_xau_20260716_0001",
  "causation_id": "req_xau_20260716_0001",
  "generated_at": "2026-07-16T00:00:03Z",
  "verdict": "APPROVE",
  "hypothesis": "LONG",
  "path": "SNR_REJECTION",
  "entry": 2416.5,
  "sl": 2414.5,
  "tp": 2418.5,
  "valid_until": "2026-07-16T00:05:02Z",
  "reason_codes": ["SNR_VALID", "RR_1_TO_1", "EVIDENCE_XAUUSD_1M", "EVIDENCE_XAUUSD_5M"],
  "rationale": "Shadow candidate: the supplied SNR reaction and M1 structure support the unchanged setup.",
  "hard_gates": {"schema_valid": true, "symbol_valid": true, "timeframe_valid": true, "spread_valid": true, "rr_valid": true, "environment_valid": true},
  "model": {"provider": "fixture", "name": "recorded-reviewer", "prompt_version": "project-a-reviewer-v1.0.0", "mode": "SHADOW", "untrusted_input_handled": true}
}
